{
  "$schema": "http://json-schema.org/draft-07/schema#",
  "title": "RuleFindings",
  "type": "array",
  "items": {
    "type": "object",
    "required": [
      "finding_id",
      "resource_type",
      "resource_id",
      "category",
      "rule_name",
      "severity",
      "description",
      "raw_config",
      "timestamp"
    ],
    "properties": {
      "finding_id": { "type": "string" },
      "resource_type": { "type": "string" },
      "resource_id": { "type": "string" },
      "category": { "type": "string" },
      "rule_name": { "type": "string" },
      "severity": { "type": "string", "enum": ["LOW", "MEDIUM", "HIGH", "CRITICAL"] },
      "description": { "type": "string" },
      "raw_config": { "type": "object" },
      "timestamp": { "type": "string" }
    }
  }
}
