[
  {
    "finding_id": "RULE-IAM-001_admin_dev",
    "resource_type": "IAM_USER",
    "resource_id": "arn:aws:iam::123456789012:user/admin_dev",
    "category": "IAM Security",
    "rule_name": "Root or Admin User Missing MFA",
    "severity": "CRITICAL",
    "description": "User admin_dev has AdministratorAccess policy attached but Multi-Factor Authentication is disabled.",
    "raw_config": {
      "mfa_active": false,
      "attached_policies": [
        "AdministratorAccess"
      ],
      "has_admin_policy": true
    },
    "timestamp": "2026-10-11T10:40:29Z"
  },
  {
    "finding_id": "RULE-IAM-001_infra_deployer",
    "resource_type": "IAM_USER",
    "resource_id": "arn:aws:iam::123456789012:user/infra_deployer",
    "category": "IAM Security",
    "rule_name": "Root or Admin User Missing MFA",
    "severity": "CRITICAL",
    "description": "User infra_deployer has AdministratorAccess policy attached but Multi-Factor Authentication is disabled.",
    "raw_config": {
      "mfa_active": false,
      "attached_policies": [
        "AdministratorAccess"
      ],
      "has_admin_policy": true
    },
    "timestamp": "2026-10-11T10:40:29Z"
  },
  {
    "finding_id": "RULE-IAM-001_root_backup",
    "resource_type": "IAM_USER",
    "resource_id": "arn:aws:iam::123456789012:user/root_backup",
    "category": "IAM Security",
    "rule_name": "Root or Admin User Missing MFA",
    "severity": "CRITICAL",
    "description": "User root_backup has AdministratorAccess policy attached but Multi-Factor Authentication is disabled.",
    "raw_config": {
      "mfa_active": false,
      "attached_policies": [
        "AdministratorAccess"
      ],
      "has_admin_policy": true
    },
    "timestamp": "2026-10-11T10:40:29Z"
  },
  {
    "finding_id": "RULE-IAM-001_julie69",
    "resource_type": "IAM_USER",
    "resource_id": "arn:aws:iam::123456789012:user/julie69",
    "category": "IAM Security",
    "rule_name": "Root or Admin User Missing MFA",
    "severity": "CRITICAL",
    "description": "User julie69 has AdministratorAccess policy attached but Multi-Factor Authentication is disabled.",
    "raw_config": {
      "mfa_active": false,
      "attached_policies": [
        "AdministratorAccess",
        "PowerUserAccess"
      ],
      "has_admin_policy": true
    },
    "timestamp": "2026-10-11T10:40:29Z"
  },
  {
    "finding_id": "RULE-IAM-001_josephbrennan",
    "resource_type": "IAM_USER",
    "resource_id": "arn:aws:iam::123456789012:user/josephbrennan",
    "category": "IAM Security",
    "rule_name": "Root or Admin User Missing MFA",
    "severity": "HIGH",
    "description": "IAM User josephbrennan does not have Multi-Factor Authentication (MFA) enabled for console or API access.",
    "raw_config": {
      "mfa_active": false,
      "attached_policies": [
        "AmazonEC2ReadOnlyAccess"
      ],
      "has_admin_policy": false
    },
    "timestamp": "2026-10-11T10:40:29Z"
  },
  {
    "finding_id": "RULE-IAM-001_williamsyvette",
    "resource_type": "IAM_USER",
    "resource_id": "arn:aws:iam::123456789012:user/williamsyvette",
    "category": "IAM Security",
    "rule_name": "Root or Admin User Missing MFA",
    "severity": "HIGH",
    "description": "IAM User williamsyvette does not have Multi-Factor Authentication (MFA) enabled for console or API access.",
    "raw_config": {
      "mfa_active": false,
      "attached_policies": [
        "AmazonS3ReadOnlyAccess"
      ],
      "has_admin_policy": false
    },
    "timestamp": "2026-10-11T10:40:29Z"
  },
  {
    "finding_id": "RULE-IAM-001_smithchristine",
    "resource_type": "IAM_USER",
    "resource_id": "arn:aws:iam::123456789012:user/smithchristine",
    "category": "IAM Security",
    "rule_name": "Root or Admin User Missing MFA",
    "severity": "HIGH",
    "description": "IAM User smithchristine does not have Multi-Factor Authentication (MFA) enabled for console or API access.",
    "raw_config": {
      "mfa_active": false,
      "attached_policies": [
        "AmazonEC2ReadOnlyAccess"
      ],
      "has_admin_policy": false
    },
    "timestamp": "2026-10-11T10:40:29Z"
  },
  {
    "finding_id": "RULE-IAM-001_elizabethgomez",
    "resource_type": "IAM_USER",
    "resource_id": "arn:aws:iam::123456789012:user/elizabethgomez",
    "category": "IAM Security",
    "rule_name": "Root or Admin User Missing MFA",
    "severity": "HIGH",
    "description": "IAM User elizabethgomez does not have Multi-Factor Authentication (MFA) enabled for console or API access.",
    "raw_config": {
      "mfa_active": false,
      "attached_policies": [
        "AmazonEC2ReadOnlyAccess"
      ],
      "has_admin_policy": false
    },
    "timestamp": "2026-10-11T10:40:29Z"
  },
  {
    "finding_id": "RULE-IAM-001_michaeljones",
    "resource_type": "IAM_USER",
    "resource_id": "arn:aws:iam::123456789012:user/michaeljones",
    "category": "IAM Security",
    "rule_name": "Root or Admin User Missing MFA",
    "severity": "CRITICAL",
    "description": "User michaeljones has AdministratorAccess policy attached but Multi-Factor Authentication is disabled.",
    "raw_config": {
      "mfa_active": false,
      "attached_policies": [
        "AdministratorAccess",
        "PowerUserAccess"
      ],
      "has_admin_policy": true
    },
    "timestamp": "2026-10-11T10:40:29Z"
  },
  {
    "finding_id": "RULE-IAM-001_osbornejeffery",
    "resource_type": "IAM_USER",
    "resource_id": "arn:aws:iam::123456789012:user/osbornejeffery",
    "category": "IAM Security",
    "rule_name": "Root or Admin User Missing MFA",
    "severity": "HIGH",
    "description": "IAM User osbornejeffery does not have Multi-Factor Authentication (MFA) enabled for console or API access.",
    "raw_config": {
      "mfa_active": false,
      "attached_policies": [
        "CloudWatchReadOnlyAccess"
      ],
      "has_admin_policy": false
    },
    "timestamp": "2026-10-11T10:40:29Z"
  },
  {
    "finding_id": "RULE-IAM-001_tracynelson",
    "resource_type": "IAM_USER",
    "resource_id": "arn:aws:iam::123456789012:user/tracynelson",
    "category": "IAM Security",
    "rule_name": "Root or Admin User Missing MFA",
    "severity": "HIGH",
    "description": "IAM User tracynelson does not have Multi-Factor Authentication (MFA) enabled for console or API access.",
    "raw_config": {
      "mfa_active": false,
      "attached_policies": [
        "AmazonS3ReadOnlyAccess"
      ],
      "has_admin_policy": false
    },
    "timestamp": "2026-10-11T10:40:29Z"
  },
  {
    "finding_id": "RULE-IAM-001_tsanders",
    "resource_type": "IAM_USER",
    "resource_id": "arn:aws:iam::123456789012:user/tsanders",
    "category": "IAM Security",
    "rule_name": "Root or Admin User Missing MFA",
    "severity": "HIGH",
    "description": "IAM User tsanders does not have Multi-Factor Authentication (MFA) enabled for console or API access.",
    "raw_config": {
      "mfa_active": false,
      "attached_policies": [
        "CloudWatchReadOnlyAccess"
      ],
      "has_admin_policy": false
    },
    "timestamp": "2026-10-11T10:40:29Z"
  },
  {
    "finding_id": "RULE-IAM-001_wfreeman",
    "resource_type": "IAM_USER",
    "resource_id": "arn:aws:iam::123456789012:user/wfreeman",
    "category": "IAM Security",
    "rule_name": "Root or Admin User Missing MFA",
    "severity": "HIGH",
    "description": "IAM User wfreeman does not have Multi-Factor Authentication (MFA) enabled for console or API access.",
    "raw_config": {
      "mfa_active": false,
      "attached_policies": [
        "AmazonS3ReadOnlyAccess"
      ],
      "has_admin_policy": false
    },
    "timestamp": "2026-10-11T10:40:29Z"
  },
  {
    "finding_id": "RULE-IAM-002_admin_dev",
    "resource_type": "IAM_USER",
    "resource_id": "arn:aws:iam::123456789012:user/admin_dev",
    "category": "IAM Security",
    "rule_name": "Overly Permissive Wildcard Administrator Access",
    "severity": "HIGH",
    "description": "IAM_USER admin_dev is granted full '*' administrative privileges via AdministratorAccess policy.",
    "raw_config": {
      "attached_policies": [
        "AdministratorAccess"
      ],
      "has_wildcard_permission": true,
      "has_admin_policy": true
    },
    "timestamp": "2026-10-11T10:40:29Z"
  },
  {
    "finding_id": "RULE-IAM-002_secops_lead",
    "resource_type": "IAM_USER",
    "resource_id": "arn:aws:iam::123456789012:user/secops_lead",
    "category": "IAM Security",
    "rule_name": "Overly Permissive Wildcard Administrator Access",
    "severity": "HIGH",
    "description": "IAM_USER secops_lead is granted full '*' administrative privileges via AdministratorAccess policy.",
    "raw_config": {
      "attached_policies": [
        "AdministratorAccess"
      ],
      "has_wildcard_permission": true,
      "has_admin_policy": true
    },
    "timestamp": "2026-10-11T10:40:29Z"
  },
  {
    "finding_id": "RULE-IAM-002_infra_deployer",
    "resource_type": "IAM_USER",
    "resource_id": "arn:aws:iam::123456789012:user/infra_deployer",
    "category": "IAM Security",
    "rule_name": "Overly Permissive Wildcard Administrator Access",
    "severity": "HIGH",
    "description": "IAM_USER infra_deployer is granted full '*' administrative privileges via AdministratorAccess policy.",
    "raw_config": {
      "attached_policies": [
        "AdministratorAccess"
      ],
      "has_wildcard_permission": true,
      "has_admin_policy": true
    },
    "timestamp": "2026-10-11T10:40:29Z"
  },
  {
    "finding_id": "RULE-IAM-002_root_backup",
    "resource_type": "IAM_USER",
    "resource_id": "arn:aws:iam::123456789012:user/root_backup",
    "category": "IAM Security",
    "rule_name": "Overly Permissive Wildcard Administrator Access",